c57c9741-46c7-487e-b520-78899bd0ddb5,2021-02-02,06:20,0,Annabelle-W8FJ4n6Wg,neutral,negative,infektion,maskenpflicht,"Wenn man manche Kommentare hier liest, macht mir die Einstellung mancher Menschen fast schon mehr Sorgen, als die Pandemie. Anscheinend müssen manche Menschen immer mit dem Finger auf andere zeigen, um auf jemanden loszugehen. Urlauber, weihnachtseinkäufer und jetzt Bartträger... was kommt denn als nächstes? ",manual_al
684a6046-25e3-4d7d-9f7c-53a3a0343bb6,2021-05-10,22:19,0,Thomas-ZUDDC3jZg,negative,negative,gewalt,gewalt,"Was ist mit der Gesamten Statistik? Warum kommen hier nur teile an? Was ist mit Gewalt gegen Kinder? Zählen die nicht? Muss denn immer nur ein Teil hier rein, warum nicht alles? ",manual_al
39e8d3a4-b286-42f1-89d5-f73184e87e22,2020-04-08,09:39,0,Lago,positive,neutral,wirtschaft,wirtschaft,"Eine Ausnahmesituation erfordert eine Ausnahmeentscheidung. Zeigen wir doch den Menschen unsere Solidarität. Wer jetzt gibt, darf später auch fordern. Wer nich sät, kann auch nicht ernten. Nehmt endlich Verantwortung wahr und zeigt, wozu Europa fähig ist. ",manual_al
aeab9367-d355-4de3-8f11-2f21a0c34939,2021-01-24,20:10,0,Kommentatorin-O8jcTKMZg,positive,neutral,schnelltests,überblick,Endlich werden Antigen-Tests für jedermann freigegeben. Halte das für einen Game-Changer. Die Regierung sollte dafür Anwendungsvideos ausstrahlen.,manual_al
59d0fc94-afd2-4f97-91ec-393d36dc93c2,2020-08-02,08:54,0,Werner-OMGIGVPZg,neutral,negative,politik,politik,Wo sind jetzt die Datenschützer? Die verklagen lieber Lehrer für den online-Unterricht während des lockdown. Die Datenschützer sind nur Krakeeler ohne jemals eine Anleitung zum praxisnahen Handeln zu liefern. Hier wäre mal ein Einsatz im Feld nötig. Aber die sitzen auf ihren Sesseln und kassieren ohne Leistung ihre Beamtenbezüge. ,manual_al
1be6433d-b1fc-4142-ad60-5d27f6546b8f,2021-04-26,19:28,0,NoWay,positive,negative,impfung,impfung,"Berlin, Brüssel die 16 Willy Wichtig, Frau Merkel und die u.vdl sollten nur noch eines auf ihre Agenda haben!  Impfstoff besorgen, schnell und nicht sabbeln!",manual_al
8ac5b97e-d9d0-42fb-a6ae-e9312ebb7f47,2020-05-09,08:45,0,Mondego,negative,negative,politik,politik,"Er hat Menschenleben auf dem Gewissen! Das sagt schon alles aus. Es ist kein Zufall, dass genau solche von Anomalien regierten Länder, die höchsten Opferzahlen beklagen.",manual_al
1a93d459-e1f5-45e4-803a-96dac15643e5,2021-03-22,09:54,0,phrasenmaeher,negative,negative,lockdown,lockdown,"Und während man im TV leicht verwundert den spannenden Ausführungen unserer Malle-Touristen am Flughafen folgt, die sich zwar ein wenig ""wegen der Zeit im Flieger"" sorgen, sich ansonsten aber auf Sangria und Sonne freuen, obwohl von beidem in der Vergangenheit wohl schon zu viel konsumiert wurde, wird denjenigen, die sich brav an alle Auflagen und auch an die Empfehlung, nicht zu reisen, halten, erneut von unserer MP-Konferenz (die mittlerweile das gute alte Parlament abgelöst zu haben scheint) ins Knie geschossen. Was für ein nicht enden wollender, großer Spaß! ",manual_al
d9331ec0-db13-4c39-91df-57d607704509,2021-07-07,11:14,0,Bruno-7pg0wMGZR,neutral,neutral,maßnahmen,maßnahmen,"nur eine kleine Kritik. Im Winter wieder die Fenster öffnen, finde ich ein wenig problematisch und die Zuschüsse des Bundes sind ja auch abhängig davon, dass Eigenanteile mitgebracht werden müssen. Deshalb kommt es einfach oft nicht zu einer Beantragung. Aber ansonsten ist das eine tolle Idee, wenn nicht wieder irgendwelche wichtigen Landeminister und/oder Schulverwaltungen bedenken anmelden.",manual_al
f81b804a-a7ac-4f26-87eb-08a26cf03ff2,2021-02-19,06:31,0,Peter-0arlAz2Mg,neutral,neutral,infektion,überblick,"Bei mir im Umfeld ist jeder erkältet, das liegt an der Kälte der letzten 10 Tage. Da hat es ein Atemwegs-Virus natürlich leicht. Jetzt wird es wärmer an Wochenende, in 7 bis 10 Tagen sinken die Neuinfektionen wieder.",manual_al
b1631185-a064-492d-943b-6c3b6f874d23,2020-06-27,09:35,0,Haarfoen,positive,neutral,arbeit,arbeit,"Die Vorschläge von Herrn Bauer zielen sicherlich in die richtige Richtung.  Das Problem ist nur, dass die eingesetzten Kräfte größtenteils nicht leistungswillig sind. Verbeamtete Lehrer können auch nicht gekündigt werden, es gibt kein ""Druckmittel"".",manual_al
2ca6e209-200a-47d9-9ccb-251a0f05cbc3,2020-04-24,20:27,0,Markus-jszEcwqWg,negative,negative,usa,usa,"Nun ja, man sieht es deutlich: Der Mann ist ein großartiges Genie: Er möchte, dass sich möglichst viele seiner Anhänger für den DARWIN AWARD qualifizieren. Der Genpool reinigt sich selbst...",manual_al
045f2914-f68a-4ac3-af57-75b59761a44a,2021-03-08,18:49,0,Alfons_Kittler,positive,positive,lockerung,lockerung,Na endlich ! Es kehrt bei wenigstens einem Bundesland die Vernunft zurück !,manual_al
c67cb9f1-6097-4d3f-804c-0ed381ca78bd,2021-03-25,11:36,0,Aquila,negative,negative,wirtschaft,impfung,"Pharmafirmen werden sich zukünftig in GB niederlassen, weil sie von dort überallhin exportieren dürfen? Echt jetzt? ;-) Finde den Fehler! Die Pharmafirmen in der EU dürfen derzeit überallhin exportieren! Die in GB dürfen umgekehrt derzeit nicht in die EU oder andere Staaten exportieren, auch die Pharmafirmen in den USA dürfen nichts exportieren, bevor nicht der Bedarf im Land gedeckt ist! ""America first"" und ""Britain first"" sind das genaue Gegenteil von dem, was der britische Minister da der Zeitung weiszumachen versucht! Protektionismus pur!",manual_al
bd72a0b7-1c36-498d-bca7-36be569dd5ff,2021-05-06,08:47,0,Haumichwech,positive,negative,impfung,überblick,"Impfen ja oder nein - 60 plus oder minus - Regeln so oder so -Verweigerer einsperren oder gutes Recht ... kann man alles diskutieren!  Nur - UND DAS IST MEIN PROBLEM - verstehe ich nix mehr! Bin 66 und lebe in SH (bin also noch nicht dran). Ruft mich mein HH (!) Internist (dort auf Warteliste) mit Impftermin an. Bekomme Biontec (obwohl das ja nur Impfzentrum und ältere AZ). Im Wartezimmer viele unter 60. Mein Sohn (28) bekommt Impftermin, weil er in der systemrelevanen Logistik arbeitet (sitzt am Computer im Homeoffice). WORÜBER wird hier prinzipiell diskutiert, wenn so oder so jeder macht was er will?",manual_al
abbc258b-42b9-4a0f-9b4d-24e0c1272ca1,2021-07-06,07:44,0,Jack123456,neutral,neutral,wirtschaft,wirtschaft,"Ist nicht so schlimm, ich nehme ein Handbesen mit um die Spinnengeweben zu entfernen, Sorgen werde ich mir machen wenn der Kapitän um 5 Minuten Geduld bittet um noch schnell einen Blick im Handbuch zu werfen. ;-) ",manual_al
50fba886-66cd-4733-bfda-86319d03f336,2020-11-16,15:02,0,Markus--8pLcG9WR,negative,negative,lockdown,maßnahmen,Ist in Deutschland je ein gesundes Kind an Corona gestorben? Das Kawasakisyndrom von dem redet niemand mehr auch so eine Panikmache. Das Coronavirus ist vorallem tödlich für die Ü60 und Risikopopulation. Also ist Solidarität gefragt. Aber ich höre nur die Panikmacher und die Verleugner schreien. Jeder Lockdown erzeugt Kollateralschäden und wer will für die haften. Corona ist für Kinder nicht gefährlich. Doch eine tröstliche Tatsache.  Deutschland ein Winterschlaf. Schlafen Sie gut. ,manual_al
3ac8abc6-68ef-4391-a7a1-94abce106842,2021-07-01,18:02,0,Friedrich-KwHsWvyWR,positive,negative,impfung,impfung,"Na, das kann ja jetzt lustig werden ! Es scheint aber wieder eine politische/pragmatische Entscheidung geben zu müssen. Wenn jetzt alle 1x Astra-Geimpften jetz auf Biontec/Moderna bestehen, werde  1.) hundertausend/Millionen Astra Dosen in den Kühlschränken rumliegen und vergammeln. Oder man kann sie ja in andere Länder verschieben, die es nötiger haben. So wir ja auch anderen ""Dreck"" in der zweiten und dritten Wlt verklappen. 2.) der nach wie vor knappe Impfstoff von Biontec wird jetzt auf eine noch größere Gruppe verteilt. Erst die U60, dann ü 60, dann Jugendlich, und nun auch noch alle Astra-Geimpften. Was das für den Impffortschritt insgesamt gilt kann sich (fast) jeder an 9 Fingern ausrechnen.   Sind denn nun die Astra-Erstlinge wichtiger, damit sie zeitgerecht ihren Vollschutz kriegen und damit wahrscheinlich (die Studien sind ja noch gar nicht abgeschlossen) gegen die Deltavariante geschützt sind (nicht nur ausreichend wie mit Doppel-Astra, sondern so richtig super duper !?) ? Oder wollen wir lieber mehr Leute gegen schwere Verläufe schützen und dafür nehmen der Leute auch eine zweite Astra-Impfung, damit mehr Biontec / Moderna für bisher ganz ungeimpfte bleibt ?  Und dafür bekommen sie dann eine Biontec Auffrischung als Drittimpfung, wenn sich die Versorgungslage entspannt hat !? DIe Empfehlung der Stiko alleine gesehen würde aus meiner Sicht ins Chaos führen. Eine übergeordnete Impfstrategie ist erforderlich.",manual_al
5a7e4d21-6297-4de2-8ebb-002d823b2746,2020-05-15,08:37,0,Holger-tHgQQZGWg,negative,negative,wirtschaft,arbeit,"Ich glaube ich hab ein Déjà-vu. Genau diese Diskussion (Schlachtbetriebe, Werkverträge, Arbeitsbedingungen, usw.) gab's vor 15 oder 20 Jahren schon einmal. Der ganze Mist wie Hartz4-Aufstocker, Werkverträge usw. gehört wieder abgeschafft. ",manual_al
f5ed9ac0-c94e-4b69-89d9-419883ab07bf,2021-07-15,06:28,0,Markus-HP_YQWxGg,neutral,neutral,infektion,überblick,"Alles vollkommen normal. Lass nur Mal eine Schulklasse infiziert sein, schon ist in manchen Stadt oder Landkreisen die Inzidenz schnell wieder bei 50.",manual_al
f5066b59-50d3-402e-b3b5-e694fc222201,2020-05-15,17:05,0,Robert-JBwDxqwZg,neutral,negative,reise,überblick,"Haha, ganz witzig. Übrigens nutzt Tui die aktuelle Panik für eine Preiserhöhung: wer jetzt auf 2021 umbucht, zalhlt 25% mehr. Frühbucherrabatt eingerechnet. Eine Recherche wert?",manual_al
146ee4bf-1a7f-4c2a-ab66-aa2d8f829466,2020-09-02,14:00,0,Christian-fE57RnEWR,neutral,neutral,politik,maßnahmen,"Spahn liegt richtig mit seiner Aussage, dass man mit dem Wissen von heute und den vorhandenen Masken Friseure und Einzelhandel hätte offen lassen können. Kein Grund zu dagen, ""siehste, haben wir ja gesagt"". Vorsicht war hier richtig.  Merkel lag falsch mit ihrer Ablehnung der Masken für die Bevölkerung. Es gelingt Frau Merlot allerdings nicht, die Berichte der BILD umzubiegen, sie waren und sind korrekt. Frau Merlot liegt falsch.",manual_al
03261512-f956-4a77-8d8d-2db307bede7f,2020-04-14,16:25,0,Speedmaster,neutral,neutral,maßnahmen,virus,"In 10 Jahren schaut man vielleicht zurück und schüttelt den Kopf angesichts der Fakten, die man dann hat (Aufwand, Schaden, Erfolge etc.). Aber bis dato wissen wir halt nicht viel. Gut, dass andere Länder voran gehen, da kann man viel lernen...",manual_al
5c9eb3d4-077f-4122-b916-e60e04215d23,2020-12-04,10:47,0,Kevin-zdd3tw0Mg,negative,neutral,maskenpflicht,wirtschaft,"Ich persönlich habe seit Beginn der Maskenpflicht in den öffentlichen Verkehrsmitteln mein ÖPNV-Abo gekündigt, detto meine Bahncard. Stattdessen habe ich meiner Frau nun einen Zweitwagen gekauft, damit wir weiterhin flexibel sind. Sollte die Maskenpflicht im ÖPNV jemals wieder fallen, komme ich gerne wieder zurück. ",manual_al
9d8c74e6-f9e7-43d0-9c1e-75910c0b55db,2021-07-09,14:25,0,Peter-Oc8jZllWg,negative,negative,lockdown,überblick,"Ethikrat-Mitglied fordert Abkehr von der »Beschränkungslogik«  Ja, es gibt Hoffnung, dass steigende Inzidenzen nicht automatisch zum alternativlosen Reflex-Lockdown führen. Auch wenn das leider kurzfristig basierend auf unserer „genialen“ Bundesnotbremse unwahrscheinlich ist. Wurde auch gleich in NRW nach dem „Sturm der Empörung“ gg die Lockerungen und dem folgenden „Zurückrudern“ angedeutet. Bleibt nur zu hoffen, dass die direkt betroffenen schon den rechtlichen Beistand parat haben… wird ein heißer Sommer …",manual_al
1bda7efa-266c-4ed4-8455-80951e191dd8,2021-02-23,14:16,0,MisanthropPhilanthrop,positive,neutral,impfung,überblick,"Ich nehme Astrazeneca sofort. Wo muss ich hin? Selbst wir im Gesundheitsamt warten noch sehr lange und haben noch keine Rückmeldung, wann wir dran sind.",manual_al
18834e3d-d267-4c65-ab0a-d698f8746fb4,2020-05-10,14:57,0,Tobias-5-uIXOjWg,positive,negative,maskenpflicht,lockerung,"Schlimm ist nicht, dass es an sich voller wird, schlimm ist schon wieder der rücksichtslose Umgang einzelner, was zum Teufel ist so schwer daran eine Maske zu tragen und Abstand zu halten. Lieber einmal stehen geblieben und gewartet als jemanden angesteckt. Lieber Fahrradfahrer auch für euch gelten die 1,5  Meter, insbesondere an der Ampel! So wenn es weiter geht, wird die Eigenverantwortung wieder eingesammelt, aber dann auch zurecht. ",manual_al
e33d4f48-aaab-4875-b69f-9fe6cfac0768,2021-06-17,10:44,0,Windkraft,positive,neutral,maßnahmen,überblick,"Spahn muss weg vom Posten... Alles an Impfstoff muss immer sofort verimpft werden. Wenn es nur ca. 400000 Impfdosen Pro Woche von Astrazeneka gibt sollte der wirklich gezielt an über 60 Jährige verimpft werden... das ist in Impfzentren nicht der Fall! Vielleicht erst mal die Eltern von Kindern unter 12 Jahren Impfen. Denn da wird es dieses Jahr sicher keine Immunisierung der Kleinen geben und das bedeutet dass sonst die betreuten Kinder alle in der Familie anstecken. Es gibt nämlich kein funktionierendes Testkonzept für Kindergärten. Sachsen sollte die Maskenpflicht im Unterricht wieder einführen, da die Impfquote an Grundschulen mindestens ein Jahr noch gleich null sein wird... sonst hat breitet sich die Delta Variante wie an Englands Schulen exponentiell aus",manual_al
59525ab4-d25c-4ed7-a80f-0a80584b834b,2021-05-24,20:07,0,Der_Fritz,neutral,neutral,lockerung,lockerung,"Irgendwie schon witzig, daß die, die am meisten geschont wurden, jetzt laut jammern.",manual_al
a0938769-7098-421b-9f68-a091cbfebb60,2020-05-04,19:51,0,Martin-z1Y-EcjWg,positive,positive,maßnahmen,lockerung,"Mein Sohn war heute das erste Mal seit 7 Wichen in der Kita und sagte mir, er habe etwas über Corona gelernt. Unter anderem wäscht er sich nun richtig die Hände. Ich und seine Mutter haben es wochenlang versucht, aber kollektiv mit anderen Kindern zusammen klappt es nach nur einem Tag hervorragend.  Finde ich gut. ",manual_al
0210360b-673b-46a4-bb95-4998e452f1a4,2020-04-01,16:15,0,Annemarie-o6DgmlwZg,negative,negative,wirtschaft,wirtschaft,"Unsere Wischenschaftler müssen es zunächst einmal schaffen, das Coronavirus in den Griff zu bekommen. Dem muss sich alles unterordnen, denn es geht für viele Menschen um Leben und Tod. Wirtschaftlich stehen viele Unternehmer finanziell massiv unter Druck und wissen nicht, wie sie die Arbeitsplätze ihrer Mitarbeiter erhalten sollen. Sie haften oft mit großen Teilen ihres Privatvermögens. Und dann kommt Frau Esken und fordert eine Vermögensabgabe. Was hat sie nur für einen Charakter, in solch einer Krise die Menschen zu belasten, die nach der Krise für Investitionen sorgen sollen. Wenn Frau Esken ihnen dann das Geld für die dann nötigen Investitionen nimmt, glaubt sie dann denn wirklich, dass der Staat die Wirtschaft besser wieder aufbauen kann? Ich kann der SPD nur raten sich von Frau Esken als Vorsitzende wieder zu trennen, denn sie versteht nichts von der Wirtschaft und hat in der Krise nicht einmal das notwendige Feingefühl, um ein Miteinander in der Gesellschaft zu fördern.",manual_al
87525e53-6338-455d-ba4b-c1c9b724c6a0,2020-08-01,16:45,0,Dirk-JzECiG8WR,negative,negative,demos,demos,"Wenn man sich die Grafiken der Johns-Hopkins-Universität anschaut sieht man dass in Deutschland und sämtlichen Nachbarländern der Graph wieder steiler nach oben geht. Absolut unverantwortlich, Demonstrationen ohne klare Regeln zu veranstalten, kaum eine/r hat ne Maske auf, alle stehen dicht zusammen und brüllen was die Lunge hergibt. Schon vergessen, dass vor wenigen Wochen ein Kirchenchor zum Hotspot wurde?  Jetzt kommen noch die Urlaubsheimkehrer, aus allen Ländern, die Demonstranten verteilen sich wieder in alle Richtungen, die Nachverfolgung wird schwieriger werden.  Was solls, wir sind ja jung und schön, kommen mit einem leichten Husten davon. Dass das Virus noch wenig erforscht ist, was Langzeitschäden für die Organe betrifft, interessiert wohl wenig.  Ich find es auch ätzend, sobald ich ein Ladenlokal betrete, eine Maske überzustülpen zu müssen, die Brille beschlägt, manchmal vergesse ich die Maske und muss noch mal zurück radeln.  In dem Kreis in dem ich lebe gibt es aktuell keine 30 Infizierte, die Chance, sich im Supermarkt zu infizieren, ist derzeit sehr gering, aber trotzdem: Nächste Woche könnten das schon 20mal mehr Infizierte sein, aus den Urlaubsgegenden und von den Demos.  Also vielen Dank an die Demo-Veranstalter, dass ihr die Solidarität mit Füßen tretet.",manual_al
c050d521-4e29-4942-9d37-f99583d1ce14,2020-04-14,11:53,0,Axel-fPwBLvsZR,neutral,negative,maßnahmen,lockerung,"Kennen die Fachleute die momentanen hygienischen Zustände in den Schulen dieses ach so reichen Landes? Ich empfehle Ortstermine in den dortigen Toiletten, die über sanitäre Anlagen der 70er verfügen.  Zu wenige Waschgelegenheiten, von denen viele noch nicht einmal funktionieren. Belegt jeder Schüler beim Waschen der Hände die empfohlenen 20 Sekunden lang das Becken, werden sich lange Schlangen bilden. Bei den Abstandsregeln vermutlich 1x quer durch die Schulen. Ich hoffe, dass man das bedenkt.",manual_al
a103adfe-d2b2-4bc4-8077-c0e3878c61e3,2021-06-12,14:57,0,Krude-YPQ456MMR,neutral,neutral,impfung,fussball,"Ich bin jetzt echt kein Fan von Turnieren während der Pandemie und habe auch entschieden etwas gegen Bevorzugung. Aber in Anbetracht dessen, dass die VIPs und Superreichen wie die Quandts usw. mit Sicherheit schon alle gimpft sind, was hätten da 300-400 Impfdosem für die deutsche Mannschaft für einen Unterschied gemacht?  Jetzt rennt da der Tross durch die Gegend, reist durch Länder und hat einfach auch körperlich Kontake während die Delta-Variante in Europa Fuß fasst... ",manual_al
97ecf46f-d45d-4703-8e3b-584c8da319cc,2020-09-11,09:08,0,Spelda,positive,neutral,maskenpflicht,maskenpflicht,"Mag ja sein, das der Artikel ein Aufruf zum Maskentragen ist. Aber es erscheint plausibel, das eine geringe Menge Viren die Abwehrkräfte des Körpers stärkt. Außerdem sehen die meisten Menschen mit Maske viel hübscher aus. Daher sollten wir auch nach Corona in der Öffentlichkeit Masken tragen. Auch zum Schutz gegen Erkältung und Grippe.",manual_al
cc762322-1533-4bdb-9bfe-f4a9e59dd7ac,2020-03-17,15:46,0,alphajet,negative,negative,politik,reise,"Ein unfassbares Versagen! Nach der Krise wird das grandiose Versagen der Verantwortlichen in Berlin, Rom, Brüssel u.a. Hauptstädten schonungslos aufgearbeitet werden (müssen).",manual_al
10f3286b-4390-4552-b8b2-8cdf8d05a27a,2020-02-20,16:40,0,Pat-Npc2hFPZR,neutral,neutral,wirtschaft,wirtschaft,Hat AirFrance eigentlich jemals Geld verdient ? So auch ohne „China-Probleme“ ? ,manual_al
dd32ef96-caff-4fe5-bdaf-2751afc6dfe1,2021-07-10,07:55,0,Water-lhEZCt-GR,positive,neutral,impfung,überblick,"Ich verstehe nicht warum man nicht noch 2 Wochen auf die Ergebnisse des sehr gut designten britischen Inselexperimentes einschließlich EM-Endspiel und Sieg wartet. (Ich gehe ja mal davon aus dass wir die Engländer haben gewinnen lassen um die Probanden in optimale Feierstimmung zu versetzen) Wir sind ja letztlich darauf angewiesen dass die Wirksamkeit der Impfung gegen schwere Verläufe und Krankenhauseinweisungen so hoch bleibt wie sie glücklicherweise ist. Mit einer Bevölkerung die in großen Teilen noch nicht einmal zu Spitzenzeiten der Inzidenzen und Todeszahlen motivierbar war eine FFP-2-Maske dicht bei Rsikobegegnungen zu tagen ist an Impfquote wohl einfach nicht mehr drin. Impfzugang erleichtern, nochmals in noch einfacherer Sprache aufklären wem eine Impfung persönlich etwas bringt und dann soweit alles hochfahren wie es der Verlauf erlaubt. ",manual_al
ef9043f8-4c02-4345-ae32-3a68e86a5cbc,2020-04-29,16:10,0,Bernd-UTQujGGWg,negative,negative,usa,usa,"Laßt uns einfach mal so vorgehen, wie es uns die Amerikaner vormachen. Laßt uns die Augen schließen und glauben, daß im Nachbarstaat nichts als unbekanntes Land/Leben stattfindet. Laßt uns einfach genauso naturblöd wie Amerikas Trump-Wähler handeln.  Wir brauchen dieses Amerika in dieser Form nicht mehr. PUNKT",manual_al
fdfabd58-1a99-47be-93a8-cbdb22dd0e43,2020-04-22,18:56,0,Klaus-RfLFFIEWR,negative,negative,politik,politik,"Endlich wieder Opposition   Habe den Eindruck,  ör und Medien fallen als 4. Kraft derzeit aus, nichts wird hinterfragt was sich so.in d politisch ereignet.   Welche Position hat der Spiegel,  oder begleitet er nur die Politik in d.  Es reicht nicht, sich über Trump auszulassen und das Geschehen hier unter Merkel durch die rosarote Brille zu sehen. Wo bleibt die Meinung des Spiegels zum herumgeeiere bzgl Masken.   Spahn bittet jetzt schon um absolution für all,die Fehler Fieber gemacht hat.  Hat die Regierung die Reproduktionsrate zu spät beachtet, war der Lockdown übereilt?  Das wären doch Fragen,  warum stellt sie der Spiegel nicht  Begleitentner nur   Das wäre zu wenig",manual_al
51db8bf3-1660-4689-a132-10b9004362ad,2021-03-24,09:20,0,ebi800,neutral,neutral,lockdown,lockdown,"Man wird wahrscheinlich über Test- und Impfstrategie sprechen. Und nicht darüber, ob Ostersamstag die Friseure .... ääääää ... wohl eher doch über Friseure.",manual_al
aeab9367-d355-4de3-8f11-2f21a0c34939,2021-01-24,13:36,0,Anna-cezlbqjZg,negative,negative,maßnahmen,überblick,"In den Niederlanden lassen sich also Menschen das ""solidarisch sein"" nicht mehr einfach so verordnen. Mal sehen, welche drakonischen Strafen hier gleich gefordert werden....  Quarantäne? Knast? Behandlungskosten selber zahlen? Oder gleich auf dem Krankenhausparkplatz ersticken lassen??",manual_al
7abfd5e9-0b6f-43f0-8f5a-2c73ca8f45a5,2021-05-20,09:55,0,Kamillo,neutral,neutral,maßnahmen,überblick,"Die Übersicht ist nett gemeint, aber jetzt muss man dennoch selbst rechericheren, wie der aktuelle Status ist. Besser wäre, bei jedem Bundesland dazu zu schreiben, wie denn die tatsächliche aktuelle Situation ist.",manual_al
ec18ed82-88ea-4ea0-b1f7-fd0754cc2f4a,2021-04-15,11:06,0,Guido-HQtLHPgGR,negative,negative,lockdown,lockdown,"LoL Wieder ein An griff auf berufstätige Eltern. Mir ist kein Ausbuch in Schulen in Deutschland bekannt, es mag welche gegeben haben, aber 99% aller Berichte waren Schulschließungen weil sich Schüler familier angesteckt haben. Anscheinend recht es schon wenn berufstätige Eltern zwangsweise zu hause bleiben. Daraus kann geschlossen werden a. Schulschließung ist nur Augenwische rei und b. Corona kommt aus der Firma ins familiere",manual_al
2a8d6123-56ad-456a-9de2-a57b6e9aeff5,2021-01-11,21:35,0,Evolutionary_Road,neutral,neutral,impfung,impfung,"Ich werfe mal ein Unterthema in den Raum. Mal sehen, ob es Meinungen dazu gibt. Ugur Sahin (BioNTech CEO) hat vorhin bei CNBC erzählt, dass bisher weder das Entwicklerteam des BioNTech-Impfstoffs noch er selbst geimpft werden “durften”.  Was halten Sie davon?",manual_al
32bcd751-f7aa-4c17-bf5a-ea168fdec71b,2021-06-22,11:01,0,Hopfezupfe,positive,positive,impfung,überblick,"Primrose Hill, bestes Wetter, die Londoner feiern den Sommer mit Picknick und Pimms. Und haben eine hohe Impfquote. Nächstes Wochenende bin ich mit auf dem Hügel und stoße als Geimpfter auf mein Ende der Pandemie an.",manual_al
7fde3261-c27b-426e-819c-51c1c95f9964,2020-05-13,09:46,0,Gerhard-g3a3A-0Wg,negative,negative,infektion,infektion,Was soll das Gerede vom Sommer? In allen Weltregionen gibt es Infektionen. Sagt doch alles,manual_al
80e04001-f1c3-45d5-9371-2be5de98653e,2020-04-28,11:40,0,Matthias-CK1qnfEWg,neutral,neutral,lockdown,lockdown,"Wo liegt denn hier genau die Strenge? Im Spanien darf man 6 Wochen Gar keiner raus. Im Artikel wird nicht ersichtlich, warum die Freiheit in Serbien noch weiter eingeschränkt wird.",manual_al
7d9c8519-86e3-47ef-a7f1-6efc70854949,2021-01-24,16:34,0,Doris Däumig-iuveyAfGR,neutral,neutral,schnelltests,lockdown,"Mitte der Woche ? Ein PCR Test dauert im Labor einige Stunden , warum dauert das dann so lange",manual_al
3f98f45a-95e0-4eea-95d2-5bf053d2cc41,2020-05-10,06:35,0,Laureus,negative,negative,politik,politik,"Lieber Herr Kurbjuweit,  ein „Zentrum der Macht“, wie Sie es in Ihrem Artikel postulieren, gibt es ja in der Form Gründung der Bundesrepublik mit Absicht nicht mehr. Dass sich die Vereinheitlichung von Bundes- und Landesregierungen der letzten Wochen wieder auflöst, ist ein gutes Zeichen für unsere Demokratie, jeglicher damit möglicherweise einhergehender „Machtverlust“ nur die Rückkehr in die föderalen Verhältnisse, die unser Land politisch ausmachen.  PS: Ihr Postulat nach einem „Zentrum der Macht“ liest sich ein wenig, als hätten Sie eine leichte Sehnsucht nach einem „starken Führer“. Davon kann ich mit Blick auf die Geschichte nur abraten.",manual_al
3ff019c4-aaa1-416e-974c-b12698bf8c57,2020-09-27,14:33,0,Matthias-DGg_U4MWg,neutral,negative,maßnahmen,infektion,"Bundeseinheitliche Regelungen würden nur den Wettbewerb zwischen den Bundesländern einschränken, der ja in vielen Bereichen für Innovation sorgt (z.B. bei Bildung, bei Steuern, ...).  Wem die Regeln im eigenen Bundesland nicht passen, kann ja umziehen bzw. die Feier in einem anderen Bundesland abhalten!",manual_al
fc320d15-0087-4b37-bfcd-292c9b005741,2021-01-03,00:12,0,AL3000,negative,negative,politik,lockdown,Läuft sein Monaten voran und profiliert sich immer wenn es geht und jetzt Herrn Spahn und der EU in den Rücken fallen. Gott bewahre uns vor wenn er Kanzlerkandidat und am Ende Kanzler wird!,manual_al
