ID,Date,Time,Comment Level,Username,Opinion,Sentiment,topic_comment,Topic_article,comment
28f557d5-a24e-46d9-a8f1-5ae46a0cc3a8,2021-01-27,09:54,0,Pet2020,,,,,"Ich würde echt einmal jedem empfehlen sich auf dem Erdball umzusehen  Besser fährt:  Israel  (unter Preisgabe der daten der Bürger an Pfizer, und unter Staatsvollhaftung Dazu sind das so wenig Impfdosen, reicht nur für 0,5% der EU)  GB: Die haben aber alles notfallzugelassen, was machbar ist  Alle anderen Staaten, die autark agieren, stehen bisher nicht besser da  Warum glauben wir dann, dass Deutschland, das sogar im BT noch der Meinung war, dass die eu zu früh bestellt hat, alleine besser gefahren wäre  Zusatz: Es kam im BT zu keiner Abstimmung, vielleicht hätte sich die Meinung, bis P3 Daten zu warten, keine Mehrheit gefunden"
adf27157-ade7-407c-af5e-3bd4ca376a87,2020-08-05,08:13,0,Pet2020,,,,,"Deutschland 2020  Da kommt ein Lockdown und zeigt brutal auf, dass unser Schulsystem mit das analogeste aller Industrienationen ist. 4 Monate später: 16 Kultusminister, meist längst im Rentenalter, haben fast gar nichts substantielles unternommen, um die fehlende Digitalisierung bei Bildung voranzutreiben.  Kommt es morgen zu einem weiteren Lockdown, dann sind die Schulen genau in derselben Situation wie vor 4 Monaten  Manchmal finde ich es extrem Schade, dass die Arbeitsverweigerung dieser greisen Fossile nicht durch Entlassung ohne Rentenbezüge bestraft werden kann. Aber was die machen ist ein Verbrechen an der Zukunft unsers Volkes  Nochmal zum Mitschreiben: 16 Kultusministerien, die ANGEBLICH untereinander im Wettbewerb stehen, haben Deutschland zum Schlusslicht bei digitaler Bildung in Europa gemacht, und es ändert sich nichts.  Als Lehrer steht man auf verlorenem Posten  Ergänzung: Es wurde etwas gemacht Es wurde alles getan, um zum alten analogen Buldungssystem zurückzukehren, mit kleineren Klassen...und einigen Desinfektionsmittelspendern Und ein Wegekonzept für Schüler.... Aber digital.....Neuland...."
494ca254-42f5-4e5c-af4f-9347471ccb63,2020-05-23,08:53,0,Pet2020,,,,,"Die Forderung lautet also Durchseuchung  Da gibts nur ein Problem, nennt sich Mathematik, also der reine Zeitbedarf für eine Durchseuchung  Problem zwei: Wenn 40% des Volkes zurecht Angst vor Durchseuchung haben müssen, dann werden sich diese Menschen selber einsperren Und dann ist die Wirtschaft mausetot, bis die Durchseuchung geschehen ist  Und das dauert eben 2 Jahre Minimum  Aber solche Details interessieren Überschriftenaufschnapper von KenFM nicht"
3d25f37f-c903-4d4b-a6c2-dddfbcc05eb2,2021-01-19,12:37,0,Pet2020,,,,,"Diese Gratismasken kosten den Steuerzahler:  1: 35 Mio mal 12 Masken (jan und Februar) mal 4 Euro: 1,7 Milliarden  2: Dazu Zuzahlung 4 Euro für 12 Masken von jedem der Berechtigten: 140 Mio, die an Kaufkraft fehlen  Im Vergleich, wenn man allen Bundesbürgern Masken schenken würde:  1: 70 Mio Bürger (Kleinkinder brauchen keine)  mal 12 mal 60 Cent: 504 Millionen  Spart 1,2 Milliarden Und alle haben Masken  Was noch fehlt bei der Rechnung:  1: Das Porto für 40 Mio Sendungen (soviele Haushalte gibt es)  2: Der Verpackungsaufwand der Masken  Den Organisationsaufwand , diese Waren an 40 Mio Haushalte zuzusenden dürfte in etwa gleich Teuer sein wie 35 Mio gefährdete Bundesbürger zu identifizieren und jeweils eine Berechtigungskarte zuzusenden  Selbst wenn pro Sendung nochmal 2 Euro extra anfallen, das sind Peanuts, es wäre immer noch 1 Milliarde billiger"
507ba3ce-4e25-4392-b8a8-dc715695d573,2021-06-29,19:27,0,Pet2020,,,,,"Und am Beispiel Delta Infektionsgefahr, was es bedeutet  In Sydney wurde nachgewiesen, dass zwei rasch aneinander vorbeigende Personen in einem  Einkaufszentrum sich infizierten  Die teilten nur extrem kurz denselben Luftraum  Australische Behörden gehen nach Unterschungen davon aus , dass es bereits ausreichend ist, denselben Luftraum auf 20 Meter Entfernung zu teilen, um sich infizieren zu können  Das sind ganz andere Spielregeln, wenn es denn stimmt  Wie gesagt, mit hoher Impfquote kein Problem, aber bis dahin sollte man sich schon noch überlegen, ob man alles erlauben sollte"
d395e42b-87b8-436d-ba58-2076c6ccc63e,2020-12-01,09:27,0,Pet2020,,,,,"Warum fängt Deutschland im ""Fühsommer"" erst an, in den arztpraxen zu impfen  Wollen wir auch da wieder einmal organisatorisches Schlusslicht der EU werden? Dafür mit 3 fachem Durchschlag?  Wir haben ab Mitte/Ende Dezember anscheinend so viel Impfstoffzugriff, dass man am besten überall Massenimfstraßen einrichten solle Jede Woche erstaprter Lockdown spart 5 Milliarden  Das ist die Summe, um die die Kultusminister aller 16 Bundesländer 2 Jahre stritten, um diese für die Digitalisierung aller Schulen Deutschlands zu erhalten  Daher. Minister ""Bürokratie"" Spahn  1: Impfbelehrung muss kein Artz machen, das geht auch online Wer dennoch eine Beratung will->separater EIngang Das vervierfacht die Kapazität  2: MTAs können genau so gut impfen wie ein Arzt  3: EIn Stadion eigenet sich ausgezeichnet für Impfungen und anschließende 30 min Impfschockwartezeit  Spanen will 13.000 Impfstationen einsatzbereit haben Und wir? 120?"
6c2374d4-1db7-4acc-9f79-68f66cf7bee9,2021-02-01,20:09,0,Pet2020,,,,,"Als Boris Johnson bedanke ich mich bei der EU für die Vorfinanzierung der AZ Lieferstätten  Streitet euch rughig wer schuld ist Wir (GB) lassen unter 100 Mio Impfdosen nichts aus GB raus  Und der gehört nicht euch sondern uns. Aber unseren vertrag, den zeigen wir nicht"
a5d28f2a-93c8-4a65-972b-47804bbb9125,2021-02-15,11:07,0,Pet2020,,,,,"Dann nehmen wir Moderna:  Jahresfertigung in der ganzen Welt: 400 Mio Impfdosen bis Ende 2021 250 davon in etwa in der Schweiz Davon wird ein Teil in Spanien ""veredelt"" 150 Mio in etwa in den USA  Von den 400 Mio Impfdosen sind vergeben (soweit mir bekannt)  150 minimum USA (Exportverbot) 160 die EU  Macht 90 Mio rest"
a249f13c-6aac-4237-ac66-44a015e2c31c,2021-03-29,17:35,0,Pet2020,,,,,"Wer wissen will wie die Länder agieren:  A: Bildungspolitik B: Investitionspolitik C: Infrastruktur D: Umwelt E: Verwaltung ...  Überall AUSNAHMSLOS  Überall  haben die Länder die Zukunft verschla*fen  Grund: Das:  A: ich bin nicht zuständig B: ich muss erst nachfragen C: Das geht nicht weil wir 10% dazuschießen müssen D: erst sollen....  Kurzum  Das allermeiste unserer Verschl*aferei sind zu 100% Ländergemachte Tatsachen  80% der Bundesmittel für Digitalisierung werden nicht abgerufen  Und wenn der Bund etwas voll bezahlt, kürzen die Länder am selben tag die eigenen Mittel, und verball*ern das woanders  Beispiel Digitalpakt Kaum war klar, dass der Bund 7 MRD springen lässt, kürzten fast alle Bundesländer drastisch die eigenen Fördermittel für digitale Ausstattung  Ergebnis: Noch mehr Stillstand, denn nun müssen alle erst neu lernen, wo es denn warum wann welches geld geben könnte  Fazit: Weg mit 16 Bundesländern, kein Mensch braucht Zwergenbundesländer wie Bremen und Co Es reichen 12  Zudem: Weg mit der Länderhoheit bei Verwaltung und Organisation "
98a47d56-83d4-4733-a410-f8c69ed02689,2020-04-08,12:37,0,Pet2020,negative,neutral,who,who,"Timeline:  9.1 WHO: China hat alles im Griff https://www.tagesschau.de/ausland/lungenkrankheit-china-101.html  17.1: WHO Minimal ansteckend 23.1: China sperrt 25 Mio Menschen weg WHO: Keine internationale Maßnahmen nötig, der Spuk ist schnell vorbei  Zu der Zeit handelten Taiwan Südkorea und Co bereits vollumfassend Selbst die USA erließen ein EInreiseverbit später, sofrt eine Reisewarnung  Die WHO hat aus Gefälligkeit 3 Wochen Zeit verschenkt, und damit den Ausbruch erst ermöglicht"
d9331ec0-db13-4c39-91df-57d607704509,2021-07-07,07:11,0,Pet2020,,,,,"Für die ganzen:""Ja aber"" internationalen Foren Fachexperten:   1: Winter:  Ein Luftaustausch binnen kurzer Zeit bedeutet keinen nenneswerten Energie bzw Wärmeverlust da die Struktur Boden Wand Decke..nicht auskühlt Also voll wintertauglich Einschränkung: Der Ventilator sollte geschlossen einen vergleichbaren UW Wert wie die Fenster haben  2: Sommer und Thermik  Ert wenn die Umgebungstemperatur über der Körpertemperatur der Schüler liegt, funktioniert der Ansatz so nicht mehr Steht auch bei Max Planck, kann man lesen! "
3fd82237-9e1e-4a1d-acf2-293eb907e361,2021-01-09,20:34,0,Pet2020,,,,,"Deutschlands Föderalismus:  Jedes Land hat wenige Fachexperten von Weltruhm, die das Wissen, das Können und die Expertise haben, so eine Volksmassenimpfung zu organisieren  Nur Deutschland glaubt wie bei der Bildung, wie beim Transprot der Vakzine, wie beim Bauwesen.....dass jedes Bundesland das in Eigenregie genau so gut kann wie....  Woher soll dass denn der Beamte XY in Hamburg können? Wochenendschulung bei Youtube?  Dazu kommt das typisch Deutsche Beamtenmikado Keiner will Verantwortung tragen, also wird es nach unten wegdeligiert  Richtig wäre AUSSCHLIEßLICH  1: Eine Webseite, eine Rufnummer für ganz Deutschland 2: Eine Instanz, die Termine vergibt 3: Eine Instanz, die bundesweite Transporte organisiert und abstimmt 4: Eine Vorgehensweise für ganz Deutschland 5: EIne Erfassungssoftware für ganz Deutschland... ...  Und was macht das digitale Nean der * tal Deutschland:  16 Versionen und bis zu 400 regionale Besonderheiten Zum schämen  Und ja, woanders läuft es schlechter Ist in D immer mehr Mode, sich mit den Schlechten zu vergleichen"
8b384fe8-714f-4e49-a800-b1d002386024,2020-12-09,07:06,0,Pet2020,,,,,"Warum funktioniert die Corona  App  (ohne Datenschutz) in Asien? Warum sagt die Wissenschaft: Flächendeckend angewendet funktioniert diese auch hier, unter Einhaltung von perfektem Datenschutz?  Und warum nutzen wir die dann nicht?"
bfbff5ac-2351-468d-bb11-fa112174bfad,2021-02-05,08:20,0,Pet2020,neutral,neutral,wirtschaft,impfung,"Manche Foristen sind sich nicht zu Schade und posten immer wieder diese angeblichen 4 Euro, die die EU pro Bürger und Nase bezahlt hätte  Was ist dran: Nichts Wird nur abgescheieben ohne nachzudenken  Grund  Im Gegenatz zu den USA ist die EU föderiert aufgetreten, das bedeutet, viele Gelder flossen nicht von der EE, sondern über Mitgliedsstaaten direkt  Als Beispiel hat Frankreich eine Milliarde alleine für Vorabsubventionen bezahlt, Deutschland etwa 600 Mio Das alleine sind schon fast diese 4 Euro   Zusammengefasst sind folgende Zahlen in etwa korrekt  1: Die EU hat alleine über 7 MRD in Vorabfinazierungen, Forschungen ,Aubventionen und Co gesteckt Macht bei 440 Mio Bürger bereits 15 Euro Gezahlt wie oben dargelegt über Staaten der EU, aber auch über Stiftungen wie B&M Gates (100 mio)  Und mit den 7 MRD war noch nichts gekauft , abgezahlt, vorfinanziert  Dazu kommen dann ettliche Zahkungen für Vorabproduktionen wie bei AZ mit fast 400 Mio "
699b9505-e620-448a-9d44-de974268b585,2021-02-01,09:33,0,Pet2020,,,,,"Nachdem so viel Unwahres erzählt wird, hier mal eine Zusammenfassung:  Die EU hat eine miese Öffentlichkeitsarbeit , denn deren Vorarbeit ist gar nicht mal so übel  Verantwortlich war Sandra Gallina, Chefin der EU-Generaldirektion Gesundheit  So habe man:  Zuanfangs mit 65 Konzernen Gespräche über Impfstoffe geführt Mit den ausichtsreichsten habe man Verträge geschlossen Wichtig war, dass sich die Konzerne an die EU Haftungsregeln und prozedere halte ... Unter anderem wurde die Produktion Vorab von Biontech und Astra Zeneca vorfinanziert ... Man habe bei den Lieferanten ein Vorranglieferrecht für die EU vereinbart (ob das bei den US Herstellern gilt glaube ich nicht) ... Die Masse Impfstoff komme ab dem 2ten Quartal .... Ab den 3ten Quartal könne man alle Bürger der EU impfen .... Im Vertrag mit Johnson&Johnson gibt einen Passus, der die Abnahme von 200 Millionen Impfdosen festlegt. Sollte sich aber herausstellen, dass zwei Impfungen notwendig seien, bekomme die Gemeinschaft 400 Millionen Dosen. .... Bei allen Nachbestellungen habe die EU Vorrang ....  Und man muss faiererweise sagen, dass der Vertrag mit AZ beinhaltet, dass ab 28.1. 300 Mio Dosen Impfstoff kommen sollten Optional würde die EU nochmal 100 Mio extra bekommen, fix zum 31.7.2021 abgeschlossen  Nur liefert AZ weniger erst einmal"
d3b9a7a1-9235-4bdf-b07b-98dbf3a76fae,2021-04-13,07:00,0,Pet2020,,,,,"Monat 14 der Pandemie  Das RKI hat Montags, Dienstags Samstags und Sonntags immer noch keine aktuellen zahlen.  Grund: Nicht die weniger stattfindenden Tests, das könnte man hochrechnen  Sondern: Keine funktionierenden digitalen Schnittstellen zwischen Landratsämtern, Gesundheitsämtern und dem RKI in 3/4 der Fälle müssen die Daten von Hand eingegeben werden Name, Adresse, Kontaktdaten, Mutationsvariante....."
c6b4377d-e8e6-40d1-a967-fd9ada3b1453,2020-08-25,09:50,0,Pet2020,,,,,"Immer wieder erstaunlich, wie sogar vermeintlich erwachsene Foristen behaupten: Schule ist nicht zuständig.....  Seit 25 Jahren schaffen es 2600 Schulen nicht, da Abhilfe zu schaffen.....  Findet den Fehler"
8dfbb7a6-04f1-46ad-867c-73286076de2c,2021-04-30,06:33,0,Pet2020,,,,,"Besonders ulkig sind die:  Die Regierung will den Dauerlockdown  krakeler  Da frage ich mich immer, ob das masochisten sind  Oder wie lässt es sich erklären, dass die tatsächlich glauben, dass sich eine Partei freiwillig auf aktuell 21% Wählerzustimmung implodieren lässt, nur weil die  angeblich im (Teil) Lockdown und Co bleiben will"
7b96a818-79b4-41b5-9771-d63c80a38972,2021-05-31,09:36,0,Pet2020,,,,,"Problem 1: Datenschutz Es ist fast unmöglich zu prüfen, da man die Daten nicht abgleichen darf  Problem 2: Alle Maßnahmen, um das ganze ""wasserdichter"" zu machen hätten viel viel Zeit und Regularien gekostet, wir wären 4 Wochen später dran gewesen  Welchen Weg will der W*üterich also haben?  Datenschutz weg, damit man mit Namen und Co prüfen kann, wer wo wen getestet hat, und ob Bürger mehr als 2 Tests die Woche machen liesen?  Oder  4 Wochen länger warten, um ein System zu etablieren, dass etwas mehr Datenschutz bei besserer Kontrolle der Abrechnung bietet?  Aufregen darf man sich gerne über:  Bund: Länder sind zuständig (was zu 100% richtig ist) Länder: Wir haben kein Personal, Bund mach Du (das ist der eigentliche Skandal) "
f08b28d7-51c6-490b-a300-e2ac77f6609f,2021-01-25,22:20,0,Pet2020,,,,,"Mathematik Teil 2 für unsere greise Gesellschaft  Durchscnittsalter in Afrika: 18 Jahre Europa etwa 43 Jahre  Mutationsbildung: Ohne Impfung ist es nur eine Frage der Zeit, bis sich Mutationen entwickeln, gegen die auch geimpfte Personen nicht immun sind Das bedeutet, dass wir dann in der EU wieder 430 Millionen Menschen impfen müssen.. Und zu den 60% Wirksamkeit:  Das war die untere Grenze bei der Dosierung, die NICHT genommen wird  Aber seis drum: Kein Grippeimpfstoff wirkt so gut  AZ kostet für 3 MRD Afrikaner in etwa 4,5 MRD Euro/9 MRD Biontech/Moderna kostet 45 bzw 90 MRD, und dauert 4 Jahre zur Herstellung  Wollen wir in Europa also schnell die Pandemie abhaken, muss auch Afrika rasch durchgeimpft werden Und ohne AZ ist das utopisch  Wer als AZ ablehnt, der kann gelich ablehnen, die Lockdowns irgendwann zu beenden"
5bd22fff-ddff-4677-9904-563967a20dad,2020-04-16,06:01,0,Pet2020,,,,,"Jeder, der sich auch nur 5 Minuten mit der Materie beschäftigt kann feststellen, dass das, was Trump sagt, sogar WHO Intern gesagt wird.  Dass Trump damit von eigenen Fehlern ablenkt ist keine Frage, aber es ist einfach so banal wahr, dass eine frühere weltweite WHO Warnung vor Corona weltweit frühere Reaktionen erzeugt hätte, und somit auch die USA deutlich geringer getroffen worden wären.  Und wir alle sollten nicht so  arrogant sein und Trump als Polterer abtun, sondern sollten uns fragen, ob den Europäern  eine 3 Wochen früher erfolgte massive Warnung der WHO  nicht 1000ende Tote erspart hätte.  Zudem sollten wir uns fragen, ob es nicht an der Zeit ist, Milliardenunternehmen, nichts anderes ist die WHO, nicht wie ein Hasenzüchterverein durch einen faktischen Sonnenkönig führen zu lassen Die Macht und die Weisungsbefugnis eines WHO Direktors kennt man in der Form nur von der FIFA/UEFA UIC und co"
47070b88-6aa0-413e-b3ef-406506523c4c,2021-02-14,07:46,0,Pet2020,negative,negative,lockdown,überblick,"Vor allem betrachte man doch mal die lächerliche Wissenschaft  Die behautet, dass ein zu frühes Ög´ffnen der teuerte Weg wäre und die behauptet, dass 80% aller Schäden nicht auf den Lockdown zurückzuführen sind  Und sowas will Wissenshcaft sein lachhaft  Ironie Ende"
33b297a7-a17c-4b24-8bf8-ee0baf158d18,2020-11-03,18:14,0,Pet2020,negative,negative,politik,schule,"Man kann gar nicht so laut weilen, so dämli ch, so schwach sinnig ist die Kultusministerriege in Deutschland  Deren Daseinsberechtigung ist nicht der Wettstreit ums beste System innerhalb Deutschlands, sondern der Wettbewerb um Posten, Futtertrog und Co  Fakten: International gilt Deutschlands digitale Bildungskompetenz als eines der schlechtesten der ganzen OECD Selbst Mexiko ist glänzendes Vorbild  Und um diese Macht zu verteidigen wird alles pla tt gemacht, was in die Entscheidungskompetenz eingreift Nur: Entscheiden wird nichts, vor allem nichts was digital bedeutet, man könnte ja vergleichbar werden  Wann endlich schafft Deutschland diesen überbordenden Bürokratiemoloch Namens Föderalismus ab  Der war toll, als man Fax und BTX brauchte, als es eine Tagesreise war, ins 50 km entfernte... Aber in zeiten von WWW sind föderale Strukturen wie in D nur eines: Zukunftsver nichtend"
b15b2a2b-0288-46ae-8f80-2f6f93a70fa8,2020-12-13,08:50,0,Pet2020,,,,,"Was machen Gesundheitsämter: Wenn jemand infiziert ist, muss der eine Kontaktliste abgeben, mit Kontaktdaten Diese werden abtelefoniert, die Personen isoliert  Dauer von Infektionsmeldung bis Nachverfolgung erledigt: Minimum 3 Tage Wobei die Kontaktliste nur die Personen beinhaltet, die der Infizierte kennt Keinen Busnebensitzer, Kunde im Laden....  Und ab so grob 30 Fällen/100.000 kommen die Gesundheitsämter nicht mehr hinterher  Ergebnis: Sehen wir heute  Lösungsansatz: Diese 3 Tage Zeitdauer Infektion/Nachverfolgung müssen viel viel kleiner werden Und diejenigen, die der Infizierte nicht kennt, die muss man dennoch finden  Lösung: Digitales Tracking Die einzige Möglichkeit oder ein lockdown  Und Asien macht genau das: Digitales Tracking Erfolgsquote: Vollkommen beeindruckend  Wir haben die technischen Mittel. Nennt sich App Ist absolut Datensicher   Aber wir nutzen das nicht  Das müssen wir irgendwann unseren Enkeln beichten, wenn die nach Opa und Oma fragen!"
8df92bcd-9177-4a56-81c6-7e2951465aac,2020-05-10,11:25,0,Pet2020,negative,negative,politik,lockerung," An den Schulen der Kinder haben wir immer und immer wieder gehört: solange vom Oberschulamt nichts kommt....  Es ist eine Kultur des wegsehens, des nicht Verantwortlich sein wollens, eine Kultur des Nichtwissens, und eine Kultur , die beratungsresistenter ist als der Vatikan"
a3a31c6b-e876-44cb-bb84-baf95681b53f,2020-11-23,19:43,0,Pet2020,,,,,"Leider auch ein Zeitgenosse, dass es nicht verstanden hat, was die App könnte  1: Begegnungen werden automatisch und anonym gewarnt, wenn verpflichtend das testergebnis durch Labore eingetragen wird  2: Kontaktnachverfolgung entfällt für die Gesundheitsämter: mehrere 10.000 Menschen könnten wichtigere Dinge machen  3: Anwesenheitslisten in restaurants und Co entfallen...  4: Letztendlich würde ein Positivergebnis sogar Menschen warnen können, bevor diese infektiös werden! .... So oder so  Vielleicht kann der Autor ja begründen, wieso eine zu 100% anonyme App nicht genau so zu einem zu nutzenden, gesetzlich vorgeschriebenen Gegenstand werden kann wie eine Maske oder ein Ausweis Ist ja anonym  Und diejenigen, die Handys haben, die die App nicht nutzen können, die bekommen kostenlos eines vom Staat gestellt.  Aber dieses freiwillige und Datenschutz...das wirft uns leider immer weiter zurück.  Als kleines Beispiel: Im Medizinsektor werden absehbar mehr Medikamente mit Datenauswertung als mit Forschung entwickelt werden. (Apple und Google investieren bereits dutzende von Milliarden)  Europa und Deutschland wird in diesem Markt aber so gar keine Rolle mehr spielen, wenn wir es nicht schaffen, Daten zwar zu schützen, aber anonym verwertbar zu machen  Nichtmal eine sinnige Stauumfahrung funktioniert ohne Datenteilung"
f0ae4d0e-7fbc-4881-83a5-e9e8aefd6978,2021-03-25,10:01,0,Pet2020,,,,,"Tja, das RKI Und Spahn Ein Paar, dass sich im Dauervers*agen gefunden hat  Nehmen wir mal die Software Sormas Was ist das: Sormas ist eine Erfindung des Epidemiologen Gérard Krause vom Helmholtz-Zentrum, als gutes Programm: eine Open Source-Plattform, die sich in Afrika bei der Bekämpfung von Ebola bewährt hat. Auch die Schweiz und Frankreich nutzen Sormas erfolgreich.   Deutschland hat beschlossen, diese Software bundesweit bis Ende Februar einzuführen  Leider gibt es ZWEI Probleme  Problem 1: Das RKI Das sieht Sormas als Konkurremz zur RKI Schnittstelle SurvNET, und verändert laufend die Architektur, so dass kein Gesundheitsamt, dass Sormas benutzt, Daten automatisch in SurvNet übertragen kann  SurvNet ist etwa 22 Jahre alt  Problem 2: Spahn  Dieser analoge Minister hat das Roll Out, also die flächendeckende Einführung des Programmes an 400 Gesundheitsämtern mit Fachexpertise unterstützen lassen:  5 Mitarbeiter am Helmholtzzentrum  und EINE Telefonkraft für die Softwarebetreeuung  Obwohl es seit einem Jahr ein Konzept von SAX und der Björn Steiger Stiftung gegeben hat, für etwa 8 Millionen mit jeweils einem 4 oder 5 Mann Team die Gesundheitsämter abzuklappern und binnen 3 bis 4 Tagen die Software zum laufen zu bringen  Fazit: 1/3 der Gesundheitsämter hat Sormas installiert Nur 90 davon nutzen es aktiv Weisungsbefugnis : fehlanzeige Weisung des Ministers ans RKI, eine Sormasschnittstelle bereitszustellen: Fehlanzeige  Ergebnis 2: Wer mit Sormas arbeitet, muss bis Dato jeden Namen, jede Adresse, jede Telefonnummer eines Meldefalles per Hand bei SurvNetQRKI eintragen  Stand: 18.3.2021  Mir fällt gar kein Wort mehr ein wie man so ein Verhalten bezeichnen kann"
a249f13c-6aac-4237-ac66-44a015e2c31c,2021-03-29,17:34,0,Pet2020,,,,," Grund: Das:  A: ich bin nicht zuständig B: ich muss erst nachfragen C: Das geht nicht weil wir 10% dazuschießen müssen D: erst sollen....  Kurzum  Das allermeiste unserer Verschlaferei sind zu 100% Ländergemachte Tatsachen  90% der Bundesmittel für Digitalisierung werden nicht abgerufen  Und wenn der Bund etwas voll bezahlt, kürzen die Länder am selben tag die eigenen Mittel, und verballern das woanders  Beispiel Digitalpakt Kaum war klar, dass der Bund 7 MRD springen lässt, kürzten fast alle Bundesländer drastisch die eigenen Fördermittel für digitale Ausstattung  Ergebnis: Noch mehr Stillstand, denn nun müssen alle erst neu lernen, wo es denn warum wann welches geld geben könnte  Fazit: Weg mit 16 Bundesländern, kein Mensch braucht Zwergenbundesländer wie Bremen und Co Es reichen 12  Zudem: Weg mit der Länderhoheit bei Verwaltung und Organisation "
699b9505-e620-448a-9d44-de974268b585,2021-02-01,07:49,0,Pet2020,,,,,"Zusammenafssend sind das hervorragende Nachrichten  1: Ist nun bei der Zwangslizenzierung der Druck dann raus 2: Gehe ich davon aus, dass nun auch AZ Panik bekommt, denn irgendwann ist der Markt gesättigt 3: Wird die EU schon passend druck machen  Einfach nochmal 3 Tage abwarten"
39fb99e4-48af-43e3-9c17-17132c20c431,2020-12-11,21:34,0,Pet2020,,,,,"Lieber S p   ieg  el  Leider kommt so gut wie nichts durch Eure Schra    nke, was mehr als 4 Zeilen hat  Was soll das denn? Warum schließt Ihr die Kommentierfunktion nicht gleich"
9c9aea47-7041-46bd-af6d-0fba7841522c,2021-02-09,11:26,0,Pet2020,,,,,"Mich würde mal interessieren, ob einer dieser ""kann nicht sein weil"" Schreiber den eigenen Beitrag seinen Kindern zeigen würde?  Und vor allem: Was würdet Ihr den Kindern dann sagen, wenn die Fragen: Ob denn die Verfasser der Studie ungebildtete Tro**el wären, undwoher der Papa das denn weiß"
98a47d56-83d4-4733-a410-f8c69ed02689,2020-04-08,12:37,0,Pet2020,negative,neutral,who,who,"Timeline:  9.1 WHO: China hat alles im Griff https://www.tagesschau.de/ausland/lungenkrankheit-china-101.html  17.1: WHO Minimal ansteckend 23.1: China sperrt 25 Mio Menschen weg WHO: Keine internationale Maßnahmen nötig, der Spuk ist schnell vorbei  Zu der Zeit handelten Taiwan Südkorea und Co bereits vollumfassend Selbst die USA erließen ein EInreiseverbit später, sofrt eine Reisewarnung  Die WHO hat aus Gefälligkeit 3 Wochen Zeit verschenkt, und damit den Ausbruch erst ermöglicht"
98a47d56-83d4-4733-a410-f8c69ed02689,2020-04-08,12:37,0,Pet2020,negative,neutral,who,who,"Timeline:  9.1 WHO: China hat alles im Griff https://www.tagesschau.de/ausland/lungenkrankheit-china-101.html  17.1: WHO Minimal ansteckend 23.1: China sperrt 25 Mio Menschen weg WHO: Keine internationale Maßnahmen nötig, der Spuk ist schnell vorbei  Zu der Zeit handelten Taiwan Südkorea und Co bereits vollumfassend Selbst die USA erließen ein EInreiseverbit später, sofrt eine Reisewarnung  Die WHO hat aus Gefälligkeit 3 Wochen Zeit verschenkt, und damit den Ausbruch erst ermöglicht"
7dc98145-5c9a-439b-aa27-252138f633d0,2021-01-28,19:16,0,Pet2020,,,,,"Zudem folgende Frage:  jede Maßnahme die der BUND vorgeschlagen hat, haben die landesfürsten einkassiert  Inwieweit hat nun Spahn eine Schuld in dem speziellen Fall  Es stimmt zwar, dass er ambitioniertere Lockdowns hätte empfehlen können, aber es kam nichtmal das Softe Maßnahmenpaket zustande, da waren die Königreiche dagegen"
9c9aea47-7041-46bd-af6d-0fba7841522c,2021-02-09,10:18,0,Pet2020,,,,,"Bin mal gespannt, wieviele international gefeierten Fachexperten wir wieder nach der Lektüre des Einzeilers haben werden"
